drop table if exists t1;
drop table if exists t2;
create table t1 (a bigint UNSIGNED not null  auto_increment,b int, primary key (a)) COMMENT REPLICA=1 ENGINE=memory AUTO_INCREMENT=3;
drop table t1;
create table t1 (
skey bigint unsigned NOT NULL auto_increment PRIMARY KEY,
sval char(20)
)COMMENT REPLICA=1 ENGINE=memory AUTO_INCREMENT=3;
insert into t1 values (1, "hello");
insert into t1 values (2, "hey");
select * from t1;
skey	sval
1	hello
2	hey
drop table t1;
create table t1 (a char(10) not null, b bigint UNSIGNED not null auto_increment, primary key(b)) COMMENT REPLICA=1 ENGINE=memory AUTO_INCREMENT=3;
insert into t1 values ("a",10),("b",20),("a",30),("c",40);
insert into t1 values ("a",50),("b",60),("c",70),("e",80);
insert into t1 (a) values ("a"),("b"),("c"),("d");
insert into t1 (a) values ('k'),('d');
insert into t1 (a) values ("a");
select * from t1;
a	b
a	3
b	4
c	5
d	6
a	10
b	20
a	30
c	40
a	50
b	60
c	70
e	80
k	92233720368547761
d	92233720368547762
a	184467440737095519
drop table t1;
create table t1 (ordid bigint(8) UNSIGNED not null auto_increment, ord  varchar(50) not null, primary key (ordid), index(ord))COMMENT REPLICA=1 ENGINE=memory AUTO_INCREMENT=3;
insert into t1 (ordid,ord) values (1,'sdj'),(2,'sdj');
select * from t1;
ordid	ord
1	sdj
2	sdj
drop table t1;
create table t1 (ordid   bigint(8) UNSIGNED not null auto_increment, ord  varchar(50) not null, primary key (ordid)) COMMENT REPLICA=1 ENGINE=memory;
insert into t1 values (1,'sdj'),(2,'sdj'),(3,"abc"),(4,'abc'),(5,'zzz'),(6,'sdj'),(7,'abc');
select * from t1;
ordid	ord
1	sdj
2	sdj
3	abc
4	abc
5	zzz
6	sdj
7	abc
drop table t1;
create table t1 (sid char(5), id bigint(2) UNSIGNED NOT NULL auto_increment, primary key(id))COMMENT REPLICA=1 ENGINE=memory ;
create table t2 (sid char(20), id bigint(2)UNSIGNED NOT NULL auto_increment, primary key(id))COMMENT REPLICA=1 ENGINE=memory AUTO_INCREMENT=3;
insert into t2 values ('skr',1),('skr',2),('test',3);
select * from t1;
sid	id
drop table t1,t2;
create table t1 (a bigint UNSIGNED not null primary key auto_increment)COMMENT REPLICA=1 ENGINE=memory AUTO_INCREMENT=3;
insert into t1 values (0);
select * from t1;
a
0
drop table t1;
create table t1 (a bigint UNSIGNED not null auto_increment primary key)COMMENT REPLICA=1 ENGINE=memory AUTO_INCREMENT=3;
insert into t1 values (1);
insert into t1 values (2);
select * from t1;
a
1
2
drop table t1;
create table t1 (a bigint UNSIGNED not null auto_increment primary key) COMMENT REPLICA=1 ENGINE=memory AUTO_INCREMENT=3;
insert into t1 values (1);
insert into t1 values (2);
select * from t1;
a
1
2
drop table t1;
create table t1 (i bigint unsigned not null auto_increment primary key)COMMENT REPLICA=1 ENGINE=memory AUTO_INCREMENT=3;
insert into t1 set i = 254;
insert into t1 set i = null;
insert into t1 set i = 256;
insert into t1 set i = null;
drop table t1;
create table t1 (i bigint unsigned not null auto_increment, primary key (i))COMMENT REPLICA=1 ENGINE=memory AUTO_INCREMENT=3;
insert into t1 set i = 254;
insert into t1 set i = null;
insert into t1 set i = null;
drop table t1;
create table t1 (i bigint unsigned not null auto_increment primary key, b int, unique (b))COMMENT REPLICA=1 ENGINE=memory AUTO_INCREMENT=1;
insert into t1 values (NULL, 10);
insert into t1 values (NULL, 15);
drop table t1;
SET sql_mode = default;
create table t1(a bigint unsigned auto_increment,b int null,primary key(a))COMMENT REPLICA=1 ENGINE=memory AUTO_INCREMENT=100;
insert into t1(a,b)values(1,1);
insert into t1(a,b)values(200,2);
insert into t1(a,b)values(0,3);
insert into t1(b)values(4);
insert into t1(b)values(5);
insert into t1(b)values(6);
insert into t1(b)values(7);
select * from t1 order by b;
a	b
1	1
200	2
0	3
100	4
92233720368547857	5
184467440737095614	6
276701161105643371	7
create table t2 (a int primary key)COMMENT REPLICA=1 ENGINE=memory AUTO_INCREMENT=100;
insert t2 values (1),(2);
drop table t2;
delete from t1 where a=0;
select * from t1 order by b;
a	b
1	1
200	2
100	4
92233720368547857	5
184467440737095614	6
276701161105643371	7
delete from t1 where a=0;
insert into t1(a,b)values(400,9);
insert into t1(a,b)values(0,10);
insert into t1(b)values(11);
insert into t1(b)values(12);
insert into t1(b)values(13);
insert into t1(b)values(14);
select * from t1 order by b;
a	b
1	1
200	2
100	4
92233720368547857	5
184467440737095614	6
276701161105643371	7
400	9
0	10
368934881474191128	11
461168601842738885	12
553402322211286642	13
645636042579834399	14
delete from t1 where a=0;
select * from t1 order by b;
a	b
1	1
200	2
100	4
92233720368547857	5
184467440737095614	6
276701161105643371	7
400	9
368934881474191128	11
461168601842738885	12
553402322211286642	13
645636042579834399	14
delete from t1 where a=0;
select * from t1 order by b;
a	b
1	1
200	2
100	4
92233720368547857	5
184467440737095614	6
276701161105643371	7
400	9
368934881474191128	11
461168601842738885	12
553402322211286642	13
645636042579834399	14
drop table t1;
create table t1 (a bigint primary key)COMMENT REPLICA=1 ENGINE=memory AUTO_INCREMENT=1;
select * from t1;
a
drop table t1;
create table t1 (a bigint primary key)COMMENT REPLICA=1 ENGINE=memory AUTO_INCREMENT=1;
insert into t1 values (1), (2), (3), (0), (0);
select * from t1;
a
0
1
2
3
drop table t1;
create table t1 (a bigint primary key)COMMENT REPLICA=1 ENGINE=memory AUTO_INCREMENT=1;
insert into t1 values (0), (1), (2), (3);
set sql_mode= '';
select * from t1;
a
0
1
2
3
drop table t1;
create table t1 (a bigint unsigned auto_increment primary key , b int null)COMMENT REPLICA=1 ENGINE=memory AUTO_INCREMENT=1;
insert into t1 values (0,1),(1,2),(2,3);
select * from t1;
a	b
0	1
1	2
2	3
insert into t1 values (10,4);
select * from t1;
a	b
0	1
1	2
2	3
10	4
drop table t1;
CREATE TABLE t1 ( a bigINT unsigned AUTO_INCREMENT, b BLOB, PRIMARY KEY (a))COMMENT REPLICA=1 ENGINE=memory AUTO_INCREMENT=1;
INSERT INTO t1 (b) VALUES ('aaaa');
INSERT INTO t1 (b) VALUES ('');
INSERT INTO t1 (b) VALUES ('bbbb');
DROP TABLE IF EXISTS t1;
CREATE TABLE `t1` (
t1_name VARCHAR(255) DEFAULT NULL,
t1_id bigINT(10) UNSIGNED NOT NULL AUTO_INCREMENT,
KEY (t1_name),
PRIMARY KEY (t1_id)
) COMMENT REPLICA=1 ENGINE=memory AUTO_INCREMENT=1;
INSERT INTO t1 (t1_name) VALUES('MySQL');
INSERT INTO t1 (t1_name) VALUES('MySQL');
INSERT INTO t1 (t1_name) VALUES('MySQL');
SELECT * from t1;
t1_name	t1_id
MySQL	1
MySQL	92233720368547759
MySQL	184467440737095517
DROP TABLE `t1`;
create table t1(a bigint unsigned not null auto_increment primary key)COMMENT REPLICA=1 ENGINE=memory AUTO_INCREMENT=10;
create table t2(a bigint unsigned not null auto_increment primary key, t1a int)COMMENT REPLICA=1 ENGINE=memory AUTO_INCREMENT=10;
insert into t1 values(NULL);
insert into t1 values (1);
insert into t1 values (NULL);
drop table t1, t2;
End of 4.1 tests
CREATE TABLE t1 ( `a` bigint(11) unsigned NOT NULL auto_increment, `b` int(11) default NULL,PRIMARY KEY  (`a`),UNIQUE KEY `b` (`b`))COMMENT REPLICA=1 ENGINE=memory AUTO_INCREMENT=1;
insert into t1 (b) values (1);
select * from t1;
a	b
1	1
insert into t1 (b) values (10);
select * from t1;
a	b
1	1
92233720368547759	10
drop table t1;
create table t1 (rowid bigint unsigned not null auto_increment, val int not null,primary
key (rowid), unique(val))COMMENT REPLICA=1 ENGINE=memory AUTO_INCREMENT=1;
insert into t1 (val) values ('1'),('2');
select * from t1;
rowid	val
1	1
2	2
drop table t1;
create table t1 (a bigint unsigned not null auto_increment primary key, val int)COMMENT REPLICA=1 ENGINE=memory AUTO_INCREMENT=1;
insert into t1 (val) values (1);
insert into t1 (val) values (1);
select * from t1;
a	val
1	1
92233720368547759	1
drop table t1;
CREATE TABLE t1 (t1 bigINT(10) PRIMARY KEY, t2 INT(10))COMMENT REPLICA=1 ENGINE=memory AUTO_INCREMENT=1;
INSERT INTO t1 VALUES(0, 0);
INSERT INTO t1 VALUES(1, 1);
DROP TABLE t1;
create table t1 (a bigint unsigned primary key auto_increment, b int, c int, d timestamp default current_timestamp, unique(b),unique(c))COMMENT REPLICA=1 ENGINE=memory AUTO_INCREMENT=1;
insert into t1 values(null,1,1,now());
insert into t1 values(null,0,0,null);
drop table t1;
create table t1 (a bigint unsigned primary key auto_increment, b int, c int, e int, d timestamp default current_timestamp, unique(b),unique(c),unique(e))COMMENT REPLICA=1 ENGINE=memory AUTO_INCREMENT=1;
insert into t1 values(null,1,1,1,now());
insert into t1 values(null,0,0,0,null);
drop table t1;
#
# Bug#46616: Assertion `!table->auto_increment_field_not_null' on view
# manipulations
#
CREATE TABLE t1 ( a INT primary key)COMMENT REPLICA=1 ENGINE=memory AUTO_INCREMENT=1;
INSERT INTO t1 VALUES (1), (1);
CREATE TABLE t2 ( a bigINT unsigned AUTO_INCREMENT primary KEY )COMMENT REPLICA=1 ENGINE=memory AUTO_INCREMENT=1;
SELECT a FROM t2;
a
DROP TABLE t1, t2;
#
# Bug#39828 autoinc wraps around when offset and increment > 1
#
CREATE TABLE t1 (c1 BIGINT UNSIGNED AUTO_INCREMENT, PRIMARY KEY(c1)) COMMENT REPLICA=1 ENGINE=memory AUTO_INCREMENT=1;
INSERT INTO t1 VALUES(1);
INSERT INTO t1 VALUES (18446744073709551601);
SELECT * FROM t1;
c1
1
18446744073709551601
DROP TABLE t1;
End of 5.1 tests
#
# Bug#50619 assert in handler::update_auto_increment
#
CREATE TABLE t1 (pk bigINT UNSIGNED AUTO_INCREMENT, PRIMARY KEY (pk))COMMENT REPLICA=1 ENGINE=memory AUTO_INCREMENT=1;
SELECT * FROM t1;
pk
DROP TABLE t1;
CREATE TABLE t1 (pk BIGINT UNSIGNED AUTO_INCREMENT, PRIMARY KEY (pk))COMMENT REPLICA=1 ENGINE=memory AUTO_INCREMENT=1;
SELECT * FROM t1;
pk
DROP TABLE t1;
